titulo,precio,provincia,num_dormitorios,num_banos,area,num_garages,ciudad,sector,lugar,rango_area,tipo_precio
Hermoso departamento de arriendo sector iaquito,500,Pichincha,2.0,2.0,95.0,1.0,Quito,Iaquito,Quito,80-120,Medio
Hermosa suite de arriendo sector iaquito,375,Pichincha,1.0,1.0,65.0,1.0,Quito,Quito,Quito,50-80,Economico
Hermoso departamento de oportunidad de arriendo sector Republica del Salvador,650,Pichincha,2.0,2.0,120.0,1.0,Quito 170135,Av. Repblica De El Salvador,Quito 170135,80-120,Medio
Hermoso departamento de arriendo de 240 metros Ponceano alto 3 dormitorios $560,560,Pichincha,3.0,3.0,240.0,2.0,Quito,Albert Einstein,Quito,180-250,Medio
Hermoso departamento de arriendo de oportunidad en la urbanizacion El Condado,580,Pichincha,3.0,4.0,128.0,2.0,Quito,Calle C,Quito,120-180,Medio
Hermosa suite de arriendo de oportunidad sector Quito Tenis,460,Pichincha,1.0,1.0,58.0,1.0,Quito,Quito Tenis,Quito,50-80,Medio
Hermoso departamento en renta sector Quito Tenis,435,Pichincha,2.0,2.0,98.0,1.0,Quito 170104,Quito Tenis,Quito 170104,80-120,Medio
Hermoso departamento de arriendo en la Urb. El condado,750,Pichincha,3.0,3.0,190.0,1.0,Quito 170134,Vgw2+Q5J,Quito 170134,180-250,Medio
Hermosa suite amoblada de arriendo sector Quito Tenis,570,Pichincha,1.0,1.0,61.0,1.0,Quito 170104,Quito Tenis,Quito 170104,50-80,Medio
Hermoso departamento en renta/venta sector Quito Tenis,1800,Pichincha,4.0,3.0,380.0,3.0,Quito 170104,Quito Tenis,Quito 170104,250-400,Lujo
Hermosa suite de arriendo de oportunidad sector Quito Tenis,500,Pichincha,1.0,1.0,70.0,1.0,Quito 170104,Quito Tenis,Quito 170104,50-80,Medio
Hermoso departamento de arriendo sector Santa Luca dos dormitorios de oportunidad,360,Pichincha,2.0,2.0,105.0,1.0,Quito,Santa Lucia,Quito,80-120,Economico
Hermoso departamento de arriendo sector Catolica 3 dormitorios de oportunidad,560,Pichincha,3.0,3.0,120.0,1.0,Quito,Catlica,Quito,80-120,Medio
Hermoso departamento de arriendo duplex ponceano alto,450,Pichincha,3.0,3.0,130.0,1.0,Quito,Ponceano Alto,Quito,120-180,Medio
Hermosa casa de arriendo de oportunidad sector Santa Luca 3 dormitorios,550,Pichincha,3.0,3.0,140.0,2.0,Quito,Santa Lucia,Quito,120-180,Medio
Hermoso departamento de arriendo de oportunidad 3 dormitorios Ponceano alto,400,Pichincha,3.0,2.0,105.0,1.0,Quito,Ponceano Alto,Quito,80-120,Medio
Hermoso departamento de arriendo de oportunidad sector Monteserrin 2 dormitorios,400,Pichincha,2.0,2.0,90.0,1.0,Quito,Monteserrin,Quito,80-120,Medio
Casa en renta con patio! Casa de arriendo Pomasqui 3 dormitorios 2 plantas,400,Pichincha,3.0,3.0,100.0,2.0,Quito,Pomasqui,Quito,80-120,Medio
Hermosa casa de arriendo sector Ponceano colegio Einstein,600,Pichincha,4.0,3.0,130.0,2.0,Quito,Ponceano Alto,Quito,120-180,Medio
Hermoso departamento de arriendo sector Carolina Alianza Francesa,550,Pichincha,3.0,2.0,110.0,1.0,Quito,La Carolina,Quito,80-120,Medio
Hermoso departamento de arriendo de oportunidad sector Quicentro Megamaxi,500,Pichincha,2.0,2.0,100.0,1.0,Quito,Avenida De Los Shyris,Quito,80-120,Medio
Hermoso departamento de arriendo amoblado Gonzlez Surez,600,Pichincha,2.0,3.0,90.0,1.0,Quito,Gonzalez Suarez,Quito,80-120,Medio
Hermoso departamento de arriendo sector El Bosque,690,Pichincha,3.0,2.0,120.0,1.0,Quito,El Bosque,Quito,80-120,Medio
Hermosa suite amoblada de arriendo sector Quito Tennis,450,Pichincha,1.0,2.0,75.0,1.0,Quito,Quito Tenis,Quito,50-80,Medio
"Departamento de Arriendo , Excelente Ubicacin",600,Pichincha,3.0,2.0,160.0,1.0,Quito,Av. Eloy Alfaro,Quito,120-180,Medio
Hermoso Departamento de Arriendo con vista espectacular y ubicacin excepcional,700,Pichincha,3.0,3.0,150.0,2.0,Av. Eloy Alfaro En La Ciudad De Quito,Av. Eloy Alfaro En La Ciudad De Quito,Av. Eloy Alfaro En La Ciudad De Quito,120-180,Medio
"Arriendo Excelente Departamento Con 3 Terrazas, Sector Granda Centeno",1200,Pichincha,4.0,4.0,350.0,2.0,Quito,Juan Jos De Villalengua,Quito,250-400,Lujo
Se arrienda local comercial grande,600,Pichincha,3.0,2.0,90.0,1.0,Machachi,Machachi,Machachi,80-120,Medio
Local Comercial de Renta en Excelente ubicacin,1200,Pichincha,3.0,1.0,100.0,1.0,Quito,Av. De Los Shyris,Quito,80-120,Lujo
DEPARTAMENTO DE 3 DORMITORIOS EN PONCEANO,460,Pichincha,3.0,2.0,115.0,2.0,Quito,Mariano Paredes,Quito,80-120,Medio
Arriendo Bonito Departamento Sector Bosmediano,550,Pichincha,3.0,2.0,92.0,2.0,Quito,Jose Bosmediano,Quito,80-120,Medio
Rento Penthouse Sector norte de Quito,2000,Pichincha,5.0,5.0,300.0,3.0,Quito,Luxemburgo,Quito,250-400,Lujo
Suite amoblada Av.Diego de Almagro y Juan Severino,680,Pichincha,1.0,2.0,51.0,1.0,Quito,Diego De Almagro,Quito,50-80,Medio
SE ARRIENDA MINIDEPARTAMENTO NORTE DE QUITO,115,Pichincha,3.0,1.0,80.0,1.0,Quito,Comit Del Pueblo,Quito,50-80,Economico
Rento amplio departamento en la Carolina,520,Pichincha,3.0,2.0,150.0,1.0,Quito,Av. Atahualpa & Iaquito,Quito,120-180,Medio
Rento departamento en sector la Carolina,750,Pichincha,2.0,2.0,87.0,1.0,Quito,Catalina De Aldaz & Av. Portugal,Quito,80-120,Lujo
"Rento Departamento Amoblado, Sector La Carolina",1390,Pichincha,3.0,3.0,126.0,1.0,Quito,Catalina De Aldaz & Avenida Portugal,Quito,120-180,Lujo
Rento Oficina-Consultorio en la Marina de Jess,520,Pichincha,3.0,2.0,84.0,2.0,Quito,Calle B & San Gabriel,Quito,80-120,Medio
RENTO DEPARTAMENTO EN EL CONJUNTO SAN MARTIN,450,Pichincha,2.0,1.0,69.0,1.0,Quito,Hernandez De Giron & Pedregal,Quito,50-80,Medio
"En Renta Casa en Conj Terracota B, Sangolqu",350,Pichincha,2.0,2.0,90.0,1.0,Sangolqu,Venezuela,Sangolqu,80-120,Medio
"LOCAL COMERCIAL EN ARRIENDO, AV.6 DE DIC. -QUITO",1200,Pichincha,3.0,2.0,186.0,1.0,Quito,Av. 6 De Diciembre,Quito,180-250,Lujo
"RENTA HERMOSO DEPARTAMENTO DPLEX, USHIMANA",380,Pichincha,3.0,2.0,145.0,2.0,Quito,Ushimana,Quito,120-180,Medio
OFICINAS EN RENTA SECTOR REPBLICA DEL SALVADOR,2800,Pichincha,3.0,3.0,216.0,3.0,Quito,Av. Republica Del Salvador & Mosc,Quito,180-250,Lujo
EN RENTA LOCAL COMERCIAL SECTOR COLIBR SANGOLQU,800,Pichincha,2.5,1.5,101.0,2.0,Sangolqu,Avenida General Rumiahui,Sangolqu,80-120,Lujo
"OFICINAS DE RENTA 143 M2, SECTOR IAQUITO",650,Pichincha,3.0,2.0,143.0,1.0,Quito,Av. Gaspar De Villarroel & Av. Amazonas,Quito,120-180,Medio
EN RENTA LOCAL COMERCIAL SECTOR COLIBR SANGOLQU,800,Pichincha,2.5,1.5,100.0,1.0,Sangolqu,Del Colibr,Sangolqu,80-120,Lujo
AMPLIAS BODEGAS DE RENTA PUSUQU SECTOR 4 ESQUINAS,380,Pichincha,3.0,2.0,90.0,1.0,Quito,Av. Manuel Crdova Galarza,Quito,80-120,Medio
LOCAL U OFICINA DE RENTA PUSUQU SECTOR 4 ESQUINAS,180,Pichincha,3.0,1.0,15.0,1.0,Quito,Av. Manuel Crdova Galarza,Quito,0-50,Economico
AMPLIO LOCAL COMERCIAL DE RENTA PUSUQU,350,Pichincha,3.0,2.0,32.0,1.0,Quito,Av. Manuel Crdova Galarza,Quito,0-50,Economico
DEPARTAMENTO DE 2 DORMITORIOS SECTOR LA PRADERA,550,Pichincha,2.0,1.0,72.0,2.0,Quito,Diego De Almagro & Alpallana,Quito,50-80,Medio
REACTIVA TU NEGOCIO- CENTRO DE LATACUNGA,120,Cotopaxi,3.0,2.0,48.0,1.0,Latacunga,Latacunga,Latacunga,0-50,Economico
Arriendo Galpn Industrial/ Bodega. Sector Parques del Recuerdo Norte,2800,Pichincha,3.0,2.0,954.0,1.0,Quito,Juncal,Quito,400+,Lujo
RENTO DEPARTAMENTO DE 2 DORMITORIOS,350,Pichincha,2.0,2.0,74.0,1.0,Quito,De Las Frutillas,Quito,50-80,Economico
Arriendo local comercial dplex en La Mariscal,1600,Pichincha,3.0,2.0,75.0,1.0,Quito,Diego De Almagro & La Pinta,Quito,50-80,Lujo
ARRIENDO SUITE AMOBLADA EN EL QUITO TENIS,750,Pichincha,1.0,1.0,125.0,1.0,Quito,Quito Tenis,Quito,120-180,Lujo
Quieres rentar consultorio Hospital de los Valles?,350,Pichincha,3.0,2.0,43.0,1.0,Quito,Av. Interocenica,Quito,0-50,Economico
DEPARTAMENTO TRES DORMITORIOS SECTOR EL BOSQUE,650,Pichincha,3.0,3.0,190.0,2.0,Quito,Av. Brasil & El Condor,Quito,180-250,Medio
Buscas rentar un departamento en Mastodontes?,350,Pichincha,3.0,1.0,125.0,1.0,Quito,Av Jaime Rolds Aguilera,Quito,120-180,Economico
Arriendo consultorio en la Clnica Pichincha,350,Pichincha,3.0,2.0,30.0,1.0,Quito,Avenida General Ignacio De Veintimilla & 9 De Octubre,Quito,0-50,Economico
"TERRENO EN RENTA 3350 M2, SAN ANTONIO DE PICHINCHA",1200,Pichincha,3.0,2.0,3350.0,1.0,Quito,San Antonio De Pichincha,Quito,,Lujo
EN RENTA  REA COMERCIAL VA AMAGUAA TAMBILLO,150,Pichincha,3.0,2.0,143.0,3.0,Tambillo,Tambillo,Tambillo,120-180,Medio
"CASA DE ARRIENDO 189 M2, SECTOR DE CONOCOTO",1000,Pichincha,5.0,3.0,180.0,1.0,Quito,Polit Lasso,Quito,120-180,Lujo
Departamento Amplio en el Norte de Quito,350,Pichincha,4.0,3.0,100.0,1.0,Quito,Jorge Piedra Y Gonzalo Gallo,Quito,80-120,Economico
LOCAL EN RENTA SAN ISIDRO la California Alta y E16 Conjunto Mirador de Amagas,200,Pichincha,3.0,1.0,23.0,1.0,Quito,Conjunto Habitacional Mirador De Amagas,Quito,0-50,Economico
"OFICINAS DE ARRIENDO 200 M2, SECTOR IAQUITO",1500,Pichincha,3.0,2.0,200.0,4.0,Quito,Avenida Gaspar De Villaroel & Japn,Quito,180-250,Lujo
LOCAL COMERCIAL DE ARRIENDO 80 M2 SECTOR AMERICA,400,Pichincha,3.0,2.0,80.0,1.0,Quito,Buenos Aires & Estados Unidos,Quito,50-80,Medio
Departamento Amplio en el Norte de Quito,380,Pichincha,3.0,2.0,120.0,1.0,Sector El Inca,Callde De Los Guabos Y De Las Cucardas,Sector El Inca,80-120,Medio
Local en Renta Terracota,450,Pichincha,2.5,1.0,110.0,1.0,Sangolqu,Sangolqu,Sangolqu,80-120,Medio
Hermoso departamento Remodelado centro norte,480,Pichincha,2.0,3.0,115.0,1.0,Calle Nuo De Valderrama Y Mariana De Jess,Sector Mariana De Jess,Calle Nuo De Valderrama Y Mariana De Jess,80-120,Medio
DEPARTAMENTO EN RENTA EN LA DIEGO DE ALMAGRO,100,Pichincha,2.0,2.0,1.0,1.0,Quito 170517,Whymper & Diego De Almagro,Quito 170517,0-50,Economico
ARRIENDO OFICINA EN SANGOLQUI VALLE DE LOS CHILLOS,230,Pichincha,2.5,1.0,53.0,1.0,Sangolqu,Sangolqu,Sangolqu,50-80,Medio
"RENTA AMPLIO DEPARTAMENTO 3D, ORIENTE QUITEO",1500,Pichincha,3.0,4.0,196.0,2.0,Quito,Quiteo Libre & Fernando Ayarza,Quito,180-250,Lujo
SUITE AMOBLADA DE RENTA TUMBACO,650,Pichincha,1.0,1.0,70.0,1.0,Quito,Tumbaco,Quito,50-80,Medio
"OFICINAS DE ARRIENDO 210 M2, SECTOR COMERCIAL NORTE",500,Pichincha,3.0,2.0,210.0,2.0,Quito,Cuero Y Caicedo,Quito,180-250,Medio
"RENTA AMPLIO LOCAL 225 m2 DUPLEX, EDIFICIO FORESTA",1800,Pichincha,1.0,2.0,253.0,3.0,Quito 170132,Alonso De Torres & Av. Edmundo Carvajal,Quito 170132,250-400,Lujo
BODEGA DE ARRIENDO 500m2 EN EL INCA BUENOS AIRES,1350,Pichincha,3.0,2.0,500.0,4.0,Quito,San Isidro Del Inca,Quito,400+,Lujo
HERMOSA Y CONFORTABLE CASA EN RENTA LA PAMPA,600,Pichincha,3.0,2.0,137.0,2.0,Quito,La Pampa,Quito,120-180,Medio
EXCELENTE DEPARTAMENTO SECTOR QUICENTRO SHOPPING,600,Pichincha,4.0,3.0,240.0,2.0,Quito,Avenida 6 De Diciembre,Quito,180-250,Medio
"EN RENTA DEPARTAMENTO, CONJUNTO DIVINO NIO",120,Pichincha,2.0,1.0,48.0,1.0,Turubamaba,Turubamaba,Turubamaba,0-50,Medio
ARRIENDO BODAGA EN EL SECTOR DE FAJARDO,1300,Pichincha,3.0,2.0,324.0,5.0,Quito,Avenida Puruhaes,Quito,250-400,Lujo
ARRIENDO BODEGA EN EL SECTOR DE FAJARDO,1300,Pichincha,3.0,2.0,324.0,1.0,Quito,Avenida Puruhaes,Quito,250-400,Lujo
SUITE AMOBLADA DE ALQUILER EN LA PRADERA,550,Pichincha,1.0,1.0,72.0,1.0,Quito,La Pradera,Quito,50-80,Medio
duplex en arriendo puente dos,400,Pichincha,4.0,5.0,300.0,1.0,Quito,Autopista General Rumiahui,Quito,250-400,Medio
ARRIENDO MINI DEPARTAMENTO EN PUERTO FRANCISCO DE ORELLANA,150,Orellana,1.0,1.0,28.0,2.0,San Sebastin Del Coca,San Sebastin Del Coca,San Sebastin Del Coca,0-50,Medio
Hermosa casa de arriendo sector Ponceano de oportunidad $580,580,Pichincha,3.0,3.0,180.0,2.0,Quito,Albert Einstein,Quito,120-180,Medio
Hermoso departamento de arriendo sector Ponceano alto 3 dormitorios de oportunidad $380,380,Pichincha,3.0,3.0,110.0,1.0,Quito,Ponceano Alto,Quito,80-120,Medio
Casa en arriendo Los Ceibos Ibarra,480,Imbabura,4.0,3.0,140.0,1.0,Calle Ro Chimbo 7-63 Y Ro Palora,Calle Ro Chimbo 7-63 Y Ro Palora,Calle Ro Chimbo 7-63 Y Ro Palora,120-180,Medio
Alquilo moderno departamento en Kennedy Norte Guayaquil,600,Guayas,2.0,2.0,68.0,1.0,Guayaquil,Kennedy Norte,Guayaquil,50-80,Medio
Se Renta Excelente Local Comercial Por Estrenar Sector San Gabriel,520,Pichincha,3.0,1.0,57.0,1.0,Quito,Hernandez De Giron,Quito,50-80,Medio
Arriendo Departamento Cerca Universidad Central,300,Pichincha,3.0,1.0,90.0,1.0,Quito,Humberto Albornoz,Quito,80-120,Economico
EN RENTA OFICINA  CONSULTORIO MDICO  LA PRADERA,265,Pichincha,3.0,1.0,34.0,1.0,Quito,Alemania & Av. Eloy Alfaro,Quito,0-50,Economico
EN RENTA DEPARTAMENTO AMOBLADO,350,Pichincha,2.0,1.0,50.0,1.0,Quito,Antiguo Aeropuerto,Quito,0-50,Economico
DEPARTAMENTO EN SAIBA,500,Guayas,3.0,3.0,120.0,1.0,Guayaquil,Ciudadela Saiba,Guayaquil,80-120,Medio
RENTA DEPARTAMENTO DE 2 DORMITORIOS URB. PUERTO AZUL VIA LA COSTA GUAYAQUIL ECUADOR,600,Guayas,2.0,4.0,68.0,1.0,Guayaquil,Urbanizacin Puerto Azul,Guayaquil,50-80,Medio
Hermosa suite de arriendo con Lnea blanca de oportunidad sector el bosque $480 incluido Alicuota,480,Pichincha,1.0,2.0,70.0,1.0,Quito,El Bosque,Quito,50-80,Medio
Hermoso departamento de arriendo de oportunidad sector Hospital Metropolitano 3 dormitorios precio $450,450,Pichincha,3.0,2.0,97.0,1.0,Quito,Avenida Mariana De Jess,Quito,80-120,Medio
Hermoso departamento de arriendo de oportunidad sector Pomasqui 2 dormitorios,280,Pichincha,2.0,1.0,80.0,1.0,Quito,Pomasqui,Quito,50-80,Economico
SE RENTA LOCAL Y OFICINA EN BELLAVISTA DE CALDERON,690,Pichincha,3.0,2.0,140.0,1.0,Quito,Calderon,Quito,120-180,Medio
LOCAL GRANDE E IDEAL PARA FRANQUICIA o RESTAURANTE,3500,Pichincha,3.0,3.0,410.0,1.0,Quito,Juan Len Mera,Quito,400+,Lujo
DEPARTAMENTO EN SAIBA,500,Guayas,3.0,2.0,150.0,1.0,Guayaquil,Ciudadela Saiba,Guayaquil,120-180,Medio
SE ARRIENDA GALPON 390 M2 EN PONCEANO,1650,Pichincha,3.0,1.0,390.0,2.0,Ponceano,Ponceano,Ponceano,250-400,Lujo
SE RENTA SUITE 95m2 SECTOR BELLAVISTA,580,Pichincha,1.0,2.0,95.0,1.0,Quito,Bellavista,Quito,80-120,Medio
OFICINA EN RENTA A POCOS METROS DEL SAN LUIS,350,Pichincha,1.0,1.0,50.0,1.0,Quito,Av San Luis,Quito,0-50,Economico
Departamento 3 dormitorios en Arriendo,350,Pichincha,3.0,2.0,140.0,1.0,Quito,Nez De Bonilla 286-340,Quito,120-180,Economico
DEPARTAMENTO EN ARRIENDO SAIBA,500,Guayas,3.0,2.0,120.0,1.0,Guayaquil,Ciudadela Saiba,Guayaquil,80-120,Medio
ARRIENDO O VENDO 1600 m2 GALPON COMERCIAL,3500,Pichincha,3.0,6.0,1600.0,22.0,Quito,Bellavista Y Las Lagunas,Quito,,Lujo
"2 DORMITORIOS, PLANTA BAJA",200,Pichincha,2.0,1.0,100.0,1.0,Chontamarca,Chontamarca,Chontamarca,80-120,Medio
Departamento amoblado de Renta en la Corua,1100,Pichincha,3.0,2.0,100.0,1.0,Quito,Avenida La Corua & Valladolid,Quito,80-120,Lujo
Oficina en renta Sector la Carolina,700,Pichincha,1.0,1.0,58.0,1.0,Quito,Avenida Republica Del Salvador,Quito,50-80,Medio
OFICINA EN RENTA SECTOR LA COLN,220,Pichincha,1.0,1.0,60.0,1.0,Quito,Av. 10 De Agosto & Javier Ascazubi,Quito,50-80,Economico
OFICINA IDEAL REACTIVATE- LA COLN,300,Pichincha,1.0,1.0,80.0,1.0,Quito,Av. 10 De Agosto & Javier Ascazubi,Quito,50-80,Economico
BONITO LOCAL COMERCIAL DE ALQUILER CAPELO,120,Pichincha,3.0,1.0,30.0,2.0,Quito,Capelo,Quito,0-50,Economico
Departamento 2D Renta sector La Kennedy,220,Pichincha,2.0,1.0,45.0,1.0,Quito,La Kennedy,Quito,0-50,Economico
HERMOSO LOFT DE ARRIENDO EN LA LEONIDAS PLAZA,500,Pichincha,1.0,1.0,17.0,1.0,Quito,Leonidas Plaza Gutierrez,Quito,0-50,Medio
EN RENTA LOCAL COMERCIAL SECTOR SAN RAFAEL,250,Pichincha,4.0,2.0,45.0,3.0,San Rafael,San Rafael,San Rafael,0-50,Economico
DE ALQUILER BODEGA EN EL COLIBR,1000,Pichincha,2.5,1.5,200.0,1.0,Sangolqu,Sangolqui,Sangolqu,180-250,Lujo
Hostel en Renta Sector el Chaupi,700,Pichincha,8.0,5.0,783.0,15.0,El Chaupi,El Chaupi,El Chaupi,400+,Medio
Departamento con Terraza Privada. Sector Mall del Sur .,300,Guayas,2.0,1.0,70.0,1.0,Ciudadela Moran Valverde,Ciudadela Moran Valverde,Ciudadela Moran Valverde,50-80,Medio
SE RENTA EDIFICIO SECTOR ESTRATEGICO EN LATACUNGA,3700,Cotopaxi,3.0,2.0,100.0,1.0,Latacunga,Latacunga,Latacunga,80-120,Lujo
SUITE AMOBLADA EN LA DIEGO DE ALMAGRO Y ALPALLANA,400,Pichincha,1.0,1.0,87.0,1.0,Quito,Diego De Almagro & Alpallana,Quito,80-120,Medio
VENDO TERRENOS EN PUEMBO,125,Pichincha,3.0,2.0,100.0,1.0,Puembo,Puembo,Puembo,80-120,Economico
Bodega en Renta Parque industrial Sangolqu,2500,Pichincha,2.5,1.5,640.0,1.0,Sangolqu,Sangolqui,Sangolqu,400+,Lujo
LOCAL U OFICINA EN EL EDIFICIO WORL TRADE CENTER,590,Pichincha,3.0,2.0,75.0,1.0,Quito,Avenue 12 De Octubre,Quito,50-80,Medio
DEPARTAMENTO DE ARRIENDO GONZALEZ SUAREZ,750,Pichincha,4.0,4.0,200.0,1.0,Quito,Gonzalez Suarez,Quito,180-250,Lujo
DEPARTAMENTO DE ARRIENDO EN COTOCOLLAO,300,Pichincha,3.0,2.0,120.0,1.0,Quito,Cotocollao,Quito,80-120,Economico
SUITE DE ARRIENDO AMOBLADA,450,Pichincha,1.0,1.0,65.0,1.0,Quito,Avenida Republica Del Salvador,Quito,50-80,Medio
Arriendo departamento en el centro de Babahoyo,220,Los Rios,2.0,1.0,87.0,1.0,Babahoyo,Calle 18 De Mayo,Babahoyo,80-120,Economico
Departamento a estrenar en el centro de Babahoyo,240,Los Rios,2.0,1.0,90.0,1.0,Babahoyo,Calle 18 De Mayo,Babahoyo,80-120,Medio
ALQUILER DEPARTAMENTO CENTRO BABAHOYO,240,Los Rios,2.0,1.0,90.0,1.0,Babahoyo,Calle 18 De Mayo,Babahoyo,80-120,Medio
ARRIENDO CASA EN CUMBAYA COLEGIO MENOR,2600,Pichincha,4.0,4.0,470.0,6.0,Quito,Cumbay,Quito,400+,Lujo
HERMOSA SUITE CON BALCN EN LA 12 DE OCTUBRE,550,Pichincha,1.0,1.0,87.0,1.0,Quito,Av. 12 De Octubre,Quito,80-120,Medio
HERMOSA SUITE FULL AMOBLADA EN LA GONZALEZ SUAREZ,500,Pichincha,1.0,1.0,110.0,1.0,Quito,Gonzalez Suarez,Quito,80-120,Medio
PISO EN RENTA PARA PEQUEA INDUSTRIA CHILLOGALLO,400,Pichincha,3.0,2.0,215.0,1.0,Quito,Chillogallo,Quito,180-250,Medio
"Departamento Dplex de 3 dormitorios en conjunto residencial Sironi, Cumbay",950,Pichincha,3.0,3.0,222.0,2.0,Quito,Cumbay,Quito,180-250,Lujo
HERMOSA SUITE FULL AMOBLADA EN LA FLORESTA,430,Pichincha,1.0,1.0,15.0,1.0,Quito,La Floresta,Quito,0-50,Medio
"ACOJEDOR DEPARTAMENTO AMOBLADO EN ALQUILER KENNEDY AV. SAN JORGE, 4 DORMITORIOS",610,Guayas,4.0,4.0,205.0,1.0,Guayaquil,Kennedy,Guayaquil,180-250,Lujo
ARRIENDO AMAZONAS CON VISTA AL PARQUE DE LA CAROLINA,500,Pichincha,3.0,3.0,140.0,1.0,Quito,Av. Ro Amazonas,Quito,120-180,Medio
Se Renta Excelente Oficina en el en Edificio Corporativo ZYRA,800,Pichincha,1.0,1.0,91.0,1.0,Quito,Avenida Portugal,Quito,80-120,Lujo
"Villa En El Sur De Guayaquil, Ciudadela Del IESS, Atrs Del Hospital Teodoro Maldonado.",350,Guayas,3.0,1.0,91.0,1.0,Guayaquil,Ciudadela Del Periodista,Guayaquil,80-120,Economico
En Renta oficina en el edificio World Trade Center,750,Pichincha,3.0,2.0,65.0,1.0,Quito,Avenue 12 De Octubre,Quito,50-80,Lujo
DEPARTAMENTO EN ARRIENDO CIUDADELA LA SAIBA,550,Guayas,3.0,2.0,120.0,1.0,Guayaquil,Ciudadela Saiba,Guayaquil,80-120,Medio
DEPARTAMENTO DE ARRIENDO SECTOR GRANDA CENTENO,500,Pichincha,2.0,1.0,142.0,2.0,Quito,Granda Centeno,Quito,120-180,Medio
RENTO DEPARTAMENTO GRANDE SECTOR LA GASCA,330,Pichincha,3.0,2.0,116.0,1.0,Quito,La Gasca,Quito,80-120,Economico
En Renta Lujosa Suite ubicada en el hotel MARRIOTT,1700,Pichincha,2.0,2.0,92.0,1.0,Quito,Avenida Francisco De Orellana,Quito,80-120,Lujo
OPORTUNIDAD NICA | LOTE PLAYERO A 5 MINUTOS DE PUERTO CAYO,6500,Manab,3.0,2.0,200.0,1.0,Manta,Manta,Manta,180-250,Medio
Hermoso departamento de arriendo con lnea blanca sector el bosque $ 470 incluido alcuota,470,Pichincha,2.0,2.0,90.0,1.0,Quito,El Bosque,Quito,80-120,Medio
Hermoso departamento de arriendo de oportunidad sector La prensa Av. el Maestro $320 incluido Alicuota,320,Pichincha,2.0,2.0,110.0,1.0,Quito,De La Prensa Y Del Maestro,Quito,80-120,Economico
Hermosa casa de arriendo de oportunidad $ 500 dlares sector Santa Luca,500,Pichincha,3.0,3.0,150.0,1.0,Quito,Santa Luca,Quito,120-180,Medio
ARRIENDO OFICINAS CON BODEGA SECTOR CALDERON,600,Pichincha,3.0,1.0,170.0,2.0,Quito,Caldern,Quito,120-180,Medio
Hermosa casa en conjunto Cordillera,500,Pichincha,3.0,3.0,180.0,2.0,Martn Ochoa Y Av Simn Bolvar (Occidental),Martn Ochoa Y Av Simn Bolvar (Occidental),Martn Ochoa Y Av Simn Bolvar (Occidental),120-180,Medio
OFICINA DE ARRIENDO SECTOR LA MARISCAL,350,Pichincha,3.0,2.0,48.0,1.0,Quito,La Mariscal,Quito,0-50,Economico
"Villa en el Sur de Guayaquil, Ciudadela Del IESS, atrs del Hospital Teodoro Maldonado.",400,Guayas,3.0,1.0,91.0,1.0,Guayaquil 090314,Av Olmedo,Guayaquil 090314,80-120,Medio
Se Arriendan Departamentos- Ciudadela Las Orqudeas,200,Guayas,2.0,2.0,80.0,1.0,Guayaquil,Las Orqudeas Este,Guayaquil,50-80,Economico
Casa Independiente en Renta Sector Santa Ines Cumbay,2600,Pichincha,3.0,3.0,300.0,4.0,Quito,Santa Ins,Quito,250-400,Lujo
EN RENTA TERRENO COMERCIAL CERCA DE LA AV. ILAL,2500,Pichincha,3.0,2.0,100.0,1.0,Quito,Av. Ilal,Quito,80-120,Lujo
ESPACIOSO DEPARTAMENTO EN RENTA SECTOR BILOXI,280,Pichincha,3.0,2.0,117.0,1.0,Quito,Biloxi,Quito,80-120,Economico
"RENTA DE SUITE SEMIAMOBLADA,CUMBAYA scala shopping",550,Pichincha,1.0,1.0,68.0,1.0,Quito,Cumbay,Quito,50-80,Medio
RENTO LOCAL COMERCIAL CON BODEGA EN CHILLOGALLO,300,Pichincha,3.0,2.0,37.0,1.0,Quito,Chillogallo,Quito,0-50,Economico
EN RENTA CASA AMOBLADA EN EL CENTRO HISTORICO,1100,Pichincha,4.0,4.0,700.0,1.0,Quito,Centro Histrico,Quito,400+,Lujo
"Arriendo Suite Amoblada, La Mariscal",450,Pichincha,1.0,2.0,60.0,1.0,Quito,La Mariscal,Quito,50-80,Medio
Arriendo departamento sector cultural La Floresta,425,Pichincha,2.0,2.0,90.0,1.0,Quito,Avenida Ladrn De Guevara & Barcelona,Quito,80-120,Medio
EN RENTA LOCAL COMERCIAL AV. PRINCIPAL CAPELO,300,Pichincha,3.0,2.0,70.0,1.0,Quito,Capelo,Quito,50-80,Economico
EN RENTA OFICINA SECTOR DEL COLIBR-SANGOLQU,180,Pichincha,2.5,1.5,27.0,1.0,Sangolqu,Avenida General Rumiahui,Sangolqu,0-50,Economico
EN RENTA OFICINA SECTOR DEL COLIBR-SANGOLQU,160,Pichincha,2.5,1.5,24.0,1.0,Sangolqu,Avenida General Rumiahui,Sangolqu,0-50,Economico
Suite sector universidad Catlica,350,Pichincha,1.0,1.0,70.0,1.0,Quito 170143,Toledo & Madrid,Quito 170143,50-80,Economico
EXCELENTE UBICACION LOCAL COMERCIAL RENTA (118M2  RUMIPAMBA),850,Pichincha,3.0,2.0,118.0,2.0,Quito,Veracruz & Avenida De La Repblica,Quito,80-120,Lujo
CASA COMERCIAL EXCELENTE UBICACION RENTA (200M2  RUMIPAMBA),1500,Pichincha,5.0,2.0,200.0,3.0,Quito,Veracruz & Avenida De La Repblica,Quito,180-250,Lujo
BODEGA COMERCIAL UBICACION ESTRATEGICA DE RENTA (87M2  RUMIPAMBA),450,Pichincha,1.0,1.0,87.0,1.0,Quito,Veracruz & Avenida De La Repblica,Quito,80-120,Medio
LOCAL EN RENTA A ESTRENAR DE 26M2 (EDF. AMELIA) MASTODONTES,200,Pichincha,1.0,1.0,26.0,1.0,Quito,Mastodontes,Quito,0-50,Economico
"Arriendo Departamento 3 Dormitorios, La Mariscal",697,Pichincha,3.0,2.0,110.0,2.0,Quito,La Mariscal,Quito,80-120,Medio
CONFORTABLE DEP. EXCELENTE UBICACION RENTA (75 MT2) RUMIPAMBA,300,Pichincha,2.0,2.0,75.0,1.0,Quito,Antonio De Ulloa & Avenida Atahualpa,Quito,50-80,Economico
DEPARTAMENTO EN RENTA,450,Pichincha,2.0,2.0,95.0,1.0,Quito,Nuez De Vela & Juan Jos De Villalengua,Quito,80-120,Medio
Casa en Renta 2 pisos  Quito,350,Pichincha,3.0,2.0,90.0,1.0,Quito,Rio Peripa,Quito,80-120,Economico
SE VENDEN EXCELENTES LOTES DE TERRENO COMERCIALES EN LA VIA EL CAMBIO CERCA AL PARQUE EN LA VIA PRINCIPAL,125,El Oro,10.0,10.0,5970.0,20.0,Machala,El Cambio,Machala,,Medio
"Arriendo Suite Amoblada, Av. America, Rumipamba",340,Pichincha,1.0,1.0,50.0,1.0,Quito,Av. Amrica,Quito,0-50,Economico
SE VENDEN DOS LOTES DE TERRENOS COMERCIALES EN LA PARROQUIA EL CAMBIO FRENTE A LA VIA PRINCIPAL,125,El Oro,10.0,10.0,5970.0,10.0,Machala,Parroquia El Cambio,Machala,,Medio
Renta de Suite Semi  Amoblada Sector La Carolina,550,Pichincha,1.0,1.0,70.0,1.0,Quito,La Carolina,Quito,50-80,Medio
Renta de Consultorio Sector Eloy Alfaro y Alemania,500,Pichincha,3.0,1.0,45.0,1.0,Quito,Avenida Eloy Alfaro,Quito,0-50,Medio
Renta Oficina Sector La Carolina,750,Pichincha,3.0,1.0,80.0,1.0,Quito,Avenida Republica Del Salvador & Avenida De Los Shyris,Quito,50-80,Lujo
Departamento en Venta/renta Sector Real Audiencia,517,Pichincha,2.0,2.0,96.0,1.0,Quito,Real Audiencia,Quito,80-120,Medio
LINDA OFICINA EN LA AV. COLON Y AMAZONAS ARRIENDO,350,Pichincha,3.0,2.0,51.0,1.0,Quito,Av. Cristbal Coln & Avenida Ro Amazonas,Quito,50-80,Economico
"Arriendo Departamento 3 Dormitorios + Estudio, La Mariscal",550,Pichincha,3.0,3.0,140.0,1.0,Quito,La Mariscal,Quito,120-180,Medio
EN RENTA OFICINA EN EL CENTRO DE SANGOLQU OFICINA 4,130,Pichincha,2.5,1.5,28.0,1.0,Sangolqu,Sangolqui,Sangolqu,0-50,Economico
EN RENTA OFICINA EN EL CENTRO DE SANGOLQU OFICINA 3,170,Pichincha,2.5,1.5,52.0,1.0,Sangolqu,Sangolqui,Sangolqu,50-80,Economico
EN RENTA OFICINA EN EL CENTRO DE SANGOLQU OFICINA 2,120,Pichincha,2.5,1.5,23.0,1.0,Sangolqu,Sangolqui,Sangolqu,0-50,Economico
EN RENTA OFICINA EN EL CENTRO DE SANGOLQU OFICINA 1,140,Pichincha,2.5,1.5,30.0,1.0,Sangolqu,Sangolqui,Sangolqu,0-50,Economico
EN RENTA OFICINA EN EL CENTRO DE SANGOLQU,150,Pichincha,2.5,1.5,38.0,1.0,Sangolqu,Sangolqui,Sangolqu,0-50,Economico
TERRENO EN VENTA COLINAS DE BRICENO TERRENO 1,6500,Manab,3.0,2.0,100.0,1.0,San Vicente,San Vicente,San Vicente,80-120,Medio
EN RENTA NAVE INDUSTRIAL  VA SANGOLQU AMAGUAA,3000,Pichincha,3.0,2.0,600.0,1.0,Quito,Amaguaa,Quito,400+,Lujo
Local de Arriendo ubicado en el Colibri,600,Pichincha,2.5,1.5,100.0,1.0,Sangolqu,Avenida General Rumiahui,Sangolqu,80-120,Medio
SE RENTA DE SUITE EN LA PRIMAVERA,450,Pichincha,1.0,1.0,45.0,1.0,Quito,La Primavera,Quito,0-50,Medio
LOCAL COMERCIAL DE RENTA GUAMAN SUR DE QUITO,3900,Pichincha,3.0,2.0,286.0,12.0,Quito,Guaman,Quito,250-400,Lujo
ARRIENDO AMPLIA CASA EN EL SECTOR DE CONOCOTO,940,Pichincha,3.0,4.0,840.0,1.0,Quito,Conocoto,Quito,400+,Lujo
RENTA AMPLIO DEPARTAMENTO SECTOR ELOY ALFARO,550,Pichincha,3.0,2.0,132.0,1.0,Quito,Av. Eloy Alfaro,Quito,120-180,Medio
LOCAL DE ARRIENDO TORRES SANTA FE 6 DE DICIEMBRE,750,Pichincha,3.0,2.0,135.0,1.0,Quito,Av. 6 De Diciembre,Quito,120-180,Lujo
TERRENO EN BALCONES DE TAPAILA  ESMERALDAS,7000,Esmeraldas,3.0,2.0,100.0,1.0,Troncal Del Pacfico,Balcones De Tapaila,Troncal Del Pacfico,80-120,Medio
"RENTO 2DO PISO DE EDIF 3 AMBIENTES, SANGOLQUI",1200,Pichincha,2.5,1.5,395.0,1.0,Sangolqu,Sangolqui,Sangolqu,250-400,Lujo
Arriendo Departamento 3 dormitorios,350,Pichincha,3.0,2.0,120.0,1.0,Quito,Asuncin & Canada,Quito,80-120,Economico
CASA EN EL SECTOR DE LA ARMENIA LA RIBERA,1800,Pichincha,3.0,3.0,485.0,5.0,Quito,La Armenia,Quito,400+,Lujo
